Tier,Source,Candidate title,Link,screener2_decision,screener2_notes
3,IEEE,Agent Evaluation via Social Network Analysis in Educational E-CARGO Framework,https://ieeexplore.ieee.org/document/11139203/,Exclude,classical E-CARGO educational MAS framework; not LLM agent eval
3,IEEE,Agentic AI Meets RAG: A Framework for Domain-Specific Knowledge Evaluation,,Exclude,RAG knowledge evaluation; not sequential LLM agent benchmark
3,IEEE,AIvaluate: A Multi-Agent Framework for Automated Answer Script Evaluation Using Large Language Models and Semantic Vector Indexing,https://ieeexplore.ieee.org/document/11155081/,Exclude,uses multi-agent LLMs to evaluate answer scripts (LLM-as-judge)
3,IEEE,ALIVE: An Agentic Longitudinal IDE-IPA Value Evaluation Framework for Innovation-Driven Enterprise Assessment,,Exclude,enterprise value assessment application; not agent benchmark
3,IEEE,An Agent-based Evaluation Framework for Complex Code Generation,https://ieeexplore.ieee.org/document/11334422/,Include,agent-based framework for evaluating complex code generation
3,IEEE,An Iterative Multi-Agent Analysis for Automated Evaluation in NLG Tasks,https://ieeexplore.ieee.org/document/11417045/,Exclude,NLG evaluation using iterative multi-agent (LLM-as-judge)
3,IEEE,Analyzing RL Agent Competency in Air Combat: A Tool for Comprehensive Performance Evaluation,https://ieeexplore.ieee.org/document/10311176/,Exclude,RL agent competency in air combat; non-LLM
3,IEEE,AutoGen-TraceKit: A Lightweight Framework for Process-Aware Evaluation of LLM Agents,,Include,process-aware evaluation framework for LLM agents (AutoGen-TraceKit)
3,IEEE,BioLabAgents: A Multi-Agent Framework for Scientific Idea Generation and Evaluation on Biomedical Research Trajectories,https://ieeexplore.ieee.org/document/11356120/,Exclude,uses multi-agent for biomedical idea evaluation; not agent benchmark
3,IEEE,"Bridging Gaps in Agentic AI: Verification, Coordination, and Evaluation",,Exclude,survey/position on agentic AI gaps
3,IEEE,Cognitive Agent Evaluation for Synthetic Pilot Training,https://ieeexplore.ieee.org/document/11257300/,Exclude,synthetic pilot training (simulation/RL); non-LLM
3,IEEE,Comparative Evaluation of Fragmentation and Encoding Strategies in a Web Agent Integrating RAG and Local LLM,https://ieeexplore.ieee.org/document/11340287/,Exclude,RAG strategy comparison within web agent; not sequential agent benchmark
3,IEEE,Contextualizing AI Agent Evaluation: Proposed Framework for Japanese Businesses,https://ieeexplore.ieee.org/document/11341698/,Include,proposed evaluation framework for AI agents in business context
3,IEEE,Enhanced Alpha-Beta Pruning and Evaluation Function Optimization for Pac-Man AI Agents,https://ieeexplore.ieee.org/document/11547420/,Exclude,classic game AI Pac-Man alpha-beta; not LLM agents
3,IEEE,Enhancing Handwritten Answer Sheet Evaluation Through Large Language Models and Multi-Agent Reasoning,https://ieeexplore.ieee.org/document/11379082/,Exclude,uses LLM for handwritten answer evaluation (LLM-as-judge)
3,IEEE,Evaluation Method of Ship Equipment Applicability Based on Agent Attention Transformer,https://ieeexplore.ieee.org/document/10920484/,Exclude,ship equipment evaluation; non-AI agent
3,IEEE,Evaluation of Graph- and Sampling-Based Path Planners for Multi-Agent Deployment in Known Urban Environments,https://ieeexplore.ieee.org/document/11494642/,Exclude,robotics path planner evaluation; non-LLM multi-agent
3,IEEE,Evaluation of LLM Powered Agentic AI for Solving Multi-Arm Bandit Problems,,Include,evaluation of LLM-powered agentic AI on sequential multi-arm bandit
3,IEEE,Evaluation of Multi-Armed Bandit Decision Making in Multi-Agent Cyber Physical Games,,Exclude,RL/cyber-physical multi-armed bandit; non-LLM
3,IEEE,FARE: Financial Agentic Reasoning and Evaluation for Earnings Call Transcripts,,Include,financial agentic reasoning and evaluation benchmark for earnings transcripts
3,IEEE,IAEAgent: LLM-Based Educational Agent for Instructional Alignment Evaluation in University Courses,https://ieeexplore.ieee.org/document/11533481/,Exclude,uses LLM agent for course alignment evaluation; not agent benchmark
3,IEEE,Implementation of Wireless Network Quality Evaluation Method for Agent Twins Based on Active Passive Dual Periodic Collaborative Measurement,https://ieeexplore.ieee.org/document/11064354/,Exclude,wireless network evaluation with agent twins; non-LLM
3,IEEE,Integrating Fuzzy Evaluation Agents and LLM-Based Robots for Multilingual Interactive Applications,https://ieeexplore.ieee.org/document/11287789/,Exclude,multilingual application with fuzzy evaluation agents
3,IEEE,"Intelligent Agents for Requirements Engineering: Use, Feasibility and Evaluation",https://ieeexplore.ieee.org/document/11190353/,Exclude,requirements engineering agent feasibility study; not benchmark
3,IEEE,Lightweight Dual-Agent Architecture for 2-D Shadow Puppetry: Real-Time Edge Deployment and Evaluation,https://ieeexplore.ieee.org/document/11435987/,Exclude,shadow puppetry application
3,IEEE,LLM-based Intelligent Evaluation Agent with Knowledge Graph Construction for Human-Machine Interactive Learning*,https://ieeexplore.ieee.org/document/11343717/,Exclude,uses LLM as evaluation agent for learning (LLM-as-judge)
3,IEEE,MAEDA: An LLM-Powered Multi-Agent Evaluation Framework for EDA Tool Documentation QA,https://ieeexplore.ieee.org/document/11539506/,Exclude,static QA EDA documentation evaluation
3,IEEE,MELF: Multi-Agent Evaluation for LLMs Fairness Based on Hierarchical Genetic Algorithm,https://ieeexplore.ieee.org/document/11388881/,Exclude,LLM fairness evaluation via multi-agent genetic algorithm optimization
3,IEEE,Multi-Agent Based Casual Triple Extraction For Factuality Evaluation Using Large Language Models,https://ieeexplore.ieee.org/document/10917708/,Exclude,triple extraction for factuality evaluation (LLM-as-judge tool)
3,IEEE,Multi-Agent Collaborative Closed-Loop Planning - Evaluation - Assessment Framework: Optimization and Interpretability Evaluation,,Include,multi-agent closed-loop planning-evaluation-assessment framework
3,IEEE,Multi-Agent Evaluation for Energy Management by Practically Scaling Q-Rank,https://ieeexplore.ieee.org/document/11292972/,Exclude,energy management evaluation; RL/classical methods
3,IEEE,Multi-Agent-Based Network Traffic Dataset Quality Evaluation Framework,,Exclude,network traffic dataset quality evaluation framework
3,IEEE,NetIQ: A Tri-Modular Dynamic Evaluation Framework for Intelligent Agent Networks,,Exclude,"intelligent agent networks eval; likely network-layer, not LLM"
3,IEEE,Persona-Driven Feedback Agents for High-Stakes Documents: A Multi-Perspective Evaluation of Global Talent Visa Submissions,https://ieeexplore.ieee.org/document/11498196/,Exclude,uses persona-driven agents to evaluate documents (LLM-as-judge)
3,IEEE,Research on Performance Evaluation Technology of Metering Devices Based on the Smart Agent for Business Expansion and Metering,https://ieeexplore.ieee.org/document/11331985/,Exclude,smart metering device performance evaluation; non-AI agent
3,IEEE,Role Assignment for Agent Evaluation Under Uncertainty: A Distributionally Robust Approach,https://ieeexplore.ieee.org/document/11192230/,,
3,IEEE,SafeDoc Agent for Facility Safety Report Evaluation,,Exclude,safety report evaluation application
3,IEEE,Self-Evaluation can Help Agents Meet Social Expectations,https://ieeexplore.ieee.org/document/11217458/,Exclude,self-evaluation application in social context; not reusable benchmark
3,IEEE,Skill Training for Space Teleoperation: DRL-Based Intelligent Agent for Training Strategy Adjustment With Innovative Evaluation,https://ieeexplore.ieee.org/document/11224535/,Exclude,DRL-based space teleoperation; non-LLM
3,IEEE,Task-Specific Trust Evaluation for Multi-Hop Collaborator Selection via GNN-Aided Distributed Agentic AI,,Exclude,GNN-aided distributed agentic AI trust; non-LLM focus
3,IEEE,Teaching Precommitted Agents: Model-Free Policy Evaluation and Control in Quasi-Hyperbolic Discounted MDPs,https://ieeexplore.ieee.org/document/11312113/,Exclude,RL model-free policy evaluation in hyperbolic MDPs
3,IEEE,Workstation Evaluation of Work from Home Call Center Agents Using ROSA,https://ieeexplore.ieee.org/document/10589117/,Exclude,human call center worker ergonomic evaluation; non-AI agent
3,Springer,"[<sup>177</sup>Lu]Lu-EDTMP —a bone pain palliating agent: pharmacokinetics, biodistribution, safety profile and clinical evaluation in osseous metastatic patients",https://doi.org/10.1007/s00259-025-07218-x,Exclude,pharmaceutical radioactive agent; non-AI
3,Springer,A Task Complexity Evaluation Framework for&#xa0;Mobile AI Agent Applications,https://doi.org/10.1007/978-3-031-94171-9_43,Include,task complexity evaluation framework for mobile AI agent applications
3,Springer,CommonHealth: Multi-agent Evaluation of&#xa0;Blockchain-Based Patient-Centred Health Networks,https://doi.org/10.1007/978-3-031-93930-3_24,Exclude,blockchain-based health network multi-agent evaluation; non-LLM
3,Springer,"Development and evaluation of a colorimetric LAMP-based biosensor for rapid detection of a nosocomial infection agent, <i>Citrobacter freundii</i>",https://doi.org/10.1038/s41598-023-49329-1,Exclude,biological nosocomial infection agent detection; non-AI
3,Springer,MATEval: A Multi-agent Discussion Framework for&#xa0;Advancing Open-Ended Text Evaluation,https://doi.org/10.1007/978-981-97-5575-2_31,Exclude,multi-agent discussion for text evaluation (LLM-as-judge)
3,Springer,"Molecular characterization and evaluation of novel management options for <i>Burkholderia glumae</i> BG1, the causative agent of panicle blight of rice (<i>Oryza sativa</i> L.)",https://doi.org/10.1007/s11033-024-09498-2,Exclude,biological pathogen molecular characterization; non-AI
3,Springer,Potential Play Evaluation with Learning-Based Agent Modeling,https://doi.org/10.1007/978-981-96-1445-5_4,Exclude,game-theoretic potential play evaluation; classical game theory
3,Springer,Preparation and Evaluation of Hydrophobically Associating Polyacrylamide Liquid Suspension Agent for Oil Well Cement,https://doi.org/10.1007/978-981-96-4922-8_68,Exclude,polyacrylamide chemical agent for oil well cement; non-AI
3,Springer,Quality Tuning and Evaluation with Agent Bricks,https://doi.org/10.1007/979-8-8688-2524-8_7,,
3,Springer,T2F: a domain-agnostic multi-agent framework for unstructured text to factuality evaluation items generation,https://doi.org/10.1007/s44163-025-00294-w,Exclude,uses multi-agent to generate factuality evaluation items (LLM-as-judge)
3,Springer,Using Generated Rubrics to&#xa0;Provide a&#xa0;Window Into Item Evaluation with&#xa0;Multi-agent LLMs,https://doi.org/10.1007/978-3-031-98420-4_15,Exclude,uses LLM agents with rubrics to evaluate items (LLM-as-judge)
3,Springer,Value-based large language model agent simulation for mutual evaluation of trust and interpersonal closeness,https://doi.org/10.1038/s41598-025-25531-1,Exclude,LLM agent social simulation for trust measurement; application
