source,title,doi,first_pass,type_hint,provisional,rationale
IEEE,Evaluation Method of Ship Equipment Applicability Based on Agent Attention Transformer,/document/10920484/,candidate_review,unclear,Borderline,no clear signal from title — needs abstract
IEEE,Evaluation of Fault Isolability in Multi-Agent Systems,,candidate_review,application/system,Borderline,application/system paper — likely EC4 unless it defines a reusable benchmark
IEEE,Evaluation of Graph- and Sampling-Based Path Planners for Multi-Agent Deployment in Known Urban Environments,/document/11494642/,candidate_review,unclear,Borderline,no clear signal from title — needs abstract
IEEE,Evaluation of LLM Powered Agentic AI for Solving Multi-Arm Bandit Problems,,candidate_agentic,unclear,Borderline,no clear signal from title — needs abstract
IEEE,Evaluation of Multi-Armed Bandit Decision Making in Multi-Agent Cyber Physical Games,,candidate_review,unclear,Borderline,no clear signal from title — needs abstract
IEEE,FARE: Financial Agentic Reasoning and Evaluation for Earnings Call Transcripts,,candidate_agentic,unclear,Borderline,no clear signal from title — needs abstract
IEEE,FitnessAgent: A Unified Agent Framework for Open-Set and Personalized Fitness Evaluation,/document/11128810/,candidate_review,application/system,Borderline,application/system paper — likely EC4 unless it defines a reusable benchmark
IEEE,"Future-Proofing Identity Security for Agentic AI Systems: Design, Implementation, and Evaluation of an Identity Fabric",,candidate_agentic,application/system,Borderline,application/system paper — likely EC4 unless it defines a reusable benchmark
IEEE,Generative AI and Multi-Agent Systems Approach to Psychometric Evaluation for Human Resource Management and Talent Acquisition,/document/11015385/,candidate_review,application/system,Borderline,application/system paper — likely EC4 unless it defines a reusable benchmark
IEEE,IAEAgent: LLM-Based Educational Agent for Instructional Alignment Evaluation in University Courses,/document/11533481/,candidate_agentic,unclear,Borderline,no clear signal from title — needs abstract
IEEE,IEBench: Benchmarking Unlearning Identity-Event Entangled Concepts for MLLM-Based Systems in Agentic Edge Networks,,candidate_agentic,benchmark/app,Borderline,named benchmark in an applied domain — confirm it is a reusable agent benchmark vs. app eval
IEEE,Implementation of Wireless Network Quality Evaluation Method for Agent Twins Based on Active Passive Dual Periodic Collaborative Measurement,/document/11064354/,candidate_review,application/system,Borderline,application/system paper — likely EC4 unless it defines a reusable benchmark
IEEE,InGen: An LLM-Agent Based Approach for Automatically Generating Evaluation Indicator System for Avionics,/document/11274390/,candidate_agentic,application/system,Borderline,application/system paper — likely EC4 unless it defines a reusable benchmark
IEEE,Integrating Fuzzy Evaluation Agents and LLM-Based Robots for Multilingual Interactive Applications,/document/11287789/,candidate_agentic,unclear,Borderline,no clear signal from title — needs abstract
IEEE,Intelligent Agent-Based Dynamic Reliability Evaluation for Optical Networks: A Comprehensive Framework and Case Study,/document/10812963/,candidate_review,application/system,Borderline,application/system paper — likely EC4 unless it defines a reusable benchmark
IEEE,"Intelligent Agents for Requirements Engineering: Use, Feasibility and Evaluation",/document/11190353/,candidate_review,unclear,Borderline,no clear signal from title — needs abstract
IEEE,Intelligent Automation of Student Record Standardization: An Evaluation of Multi-AI Agent Efficacy in Educational Administration,,candidate_agentic,application/system,Borderline,application/system paper — likely EC4 unless it defines a reusable benchmark
IEEE,Lightweight Dual-Agent Architecture for 2-D Shadow Puppetry: Real-Time Edge Deployment and Evaluation,/document/11435987/,candidate_review,unclear,Borderline,no clear signal from title — needs abstract
IEEE,LLM-Based Dynamic Multi-Agent Systems for Evaluation of Financial Trading Mechanism,,candidate_agentic,application/system,Borderline,application/system paper — likely EC4 unless it defines a reusable benchmark
IEEE,LLM-based Intelligent Evaluation Agent with Knowledge Graph Construction for Human-Machine Interactive Learning*,/document/11343717/,candidate_agentic,unclear,Borderline,no clear signal from title — needs abstract
IEEE,MACS: A Cognitive Diversity Multi-Agent Consensus Framework for Bias Mitigation in Automated Evaluation Systems,,candidate_review,application/system,Borderline,application/system paper — likely EC4 unless it defines a reusable benchmark
IEEE,MAEDA: An LLM-Powered Multi-Agent Evaluation Framework for EDA Tool Documentation QA,/document/11539506/,candidate_agentic,unclear,Borderline,no clear signal from title — needs abstract
IEEE,MELF: Multi-Agent Evaluation for LLMs Fairness Based on Hierarchical Genetic Algorithm,/document/11388881/,candidate_agentic,unclear,Borderline,no clear signal from title — needs abstract
IEEE,Mission Reliability Evaluation of Dynamic Distributed Cooperative Systems Based on Multi-agent Modeling and Simulation,/document/10336149/,candidate_review,application/system,Borderline,application/system paper — likely EC4 unless it defines a reusable benchmark
IEEE,Multi-Agent Based Casual Triple Extraction For Factuality Evaluation Using Large Language Models,/document/10917708/,candidate_agentic,unclear,Borderline,no clear signal from title — needs abstract
IEEE,Multi-Agent Collaborative Closed-Loop Planning - Evaluation - Assessment Framework: Optimization and Interpretability Evaluation,,candidate_review,unclear,Borderline,no clear signal from title — needs abstract
IEEE,Multi-Agent Cooperative Perception: A Structural Evaluation Framework for Autonomous Systems,,candidate_review,application/system,Borderline,application/system paper — likely EC4 unless it defines a reusable benchmark
IEEE,Multi-Agent Evaluation for Energy Management by Practically Scaling Q-Rank,/document/11292972/,candidate_review,unclear,Borderline,no clear signal from title — needs abstract
IEEE,"Multi-Agent Systems and Agentic AI in Business Process Automation: Taxonomy, Benchmarks, and an Open Research Agenda",,candidate_agentic,survey,Borderline,survey/review/workshop (IC3? — check)
IEEE,Multi-Agent-Based Network Traffic Dataset Quality Evaluation Framework,,candidate_review,application/system,Borderline,application/system paper — likely EC4 unless it defines a reusable benchmark
IEEE,NetIQ: A Tri-Modular Dynamic Evaluation Framework for Intelligent Agent Networks,,candidate_review,application/system,Borderline,application/system paper — likely EC4 unless it defines a reusable benchmark
IEEE,Persona-Driven Feedback Agents for High-Stakes Documents: A Multi-Perspective Evaluation of Global Talent Visa Submissions,/document/11498196/,candidate_review,unclear,Borderline,no clear signal from title — needs abstract
IEEE,Research on Performance Evaluation Technology of Metering Devices Based on the Smart Agent for Business Expansion and Metering,/document/11331985/,candidate_review,unclear,Borderline,no clear signal from title — needs abstract
IEEE,Retrieval Augmented Generation (RAG) for Fintech: Agentic Design and Evaluation,,candidate_agentic,application/system,Borderline,application/system paper — likely EC4 unless it defines a reusable benchmark
IEEE,Role Assignment for Agent Evaluation Under Uncertainty: A Distributionally Robust Approach,/document/11192230/,candidate_review,unclear,Borderline,no clear signal from title — needs abstract
IEEE,SafeDoc Agent for Facility Safety Report Evaluation,,candidate_review,unclear,Borderline,no clear signal from title — needs abstract
IEEE,Self-Evaluation can Help Agents Meet Social Expectations,/document/11217458/,candidate_review,unclear,Borderline,no clear signal from title — needs abstract
IEEE,Skill Training for Space Teleoperation: DRL-Based Intelligent Agent for Training Strategy Adjustment With Innovative Evaluation,/document/11224535/,candidate_review,unclear,Borderline,no clear signal from title — needs abstract
IEEE,Stable and Expert-Aligned Evaluation of Wargaming Strategies via Optimized LLM Scoring Agents,/document/11336231/,candidate_agentic,application/system,Borderline,application/system paper — likely EC4 unless it defines a reusable benchmark
IEEE,Task-Specific Trust Evaluation for Multi-Hop Collaborator Selection via GNN-Aided Distributed Agentic AI,,candidate_agentic,unclear,Borderline,no clear signal from title — needs abstract
IEEE,Teaching Precommitted Agents: Model-Free Policy Evaluation and Control in Quasi-Hyperbolic Discounted MDPs,/document/11312113/,candidate_review,unclear,Borderline,no clear signal from title — needs abstract
IEEE,Workstation Evaluation of Work from Home Call Center Agents Using ROSA,/document/10589117/,candidate_review,unclear,Borderline,no clear signal from title — needs abstract
Springer,1001 Games a&#xa0;Night—Continuous Evaluation of&#xa0;an&#xa0;Intelligent Multi-agent-Based System,10.1007/978-981-99-3091-3_59,candidate_review,application/system,Borderline,application/system paper — likely EC4 unless it defines a reusable benchmark
Springer,"[<sup>177</sup>Lu]Lu-EDTMP —a bone pain palliating agent: pharmacokinetics, biodistribution, safety profile and clinical evaluation in osseous metastatic patients",10.1007/s00259-025-07218-x,candidate_review,unclear,Borderline,no clear signal from title — needs abstract
Springer,A Comprehensive Framework for&#xa0;Turn-Taking Evaluation in&#xa0;Multi-agent Systems: Rotational Periodicity for&#xa0;Scalable Coordination Analysis,10.1007/978-3-032-03711-4_16,candidate_agentic,application/system,Borderline,application/system paper — likely EC4 unless it defines a reusable benchmark
Springer,A multi-agent large language model framework for intelligent vendor evaluation and risk-aware procurement decisions,10.1038/s41598-026-50952-x,candidate_agentic,application/system,Borderline,application/system paper — likely EC4 unless it defines a reusable benchmark
Springer,A Task Complexity Evaluation Framework for&#xa0;Mobile AI Agent Applications,10.1007/978-3-031-94171-9_43,candidate_agentic,unclear,Borderline,no clear signal from title — needs abstract
Springer,Actions Speak Louder Than Words: Evidence-Based Trust Level Evaluation in&#xa0;Multi-agent Systems,10.1007/978-981-95-3543-9_14,candidate_agentic,application/system,Borderline,application/system paper — likely EC4 unless it defines a reusable benchmark
Springer,Adaptive monitoring and real-world evaluation of agentic AI systems,10.1007/s43681-026-00990-y,candidate_agentic,application/system,Borderline,application/system paper — likely EC4 unless it defines a reusable benchmark
Springer,CommonHealth: Multi-agent Evaluation of&#xa0;Blockchain-Based Patient-Centred Health Networks,10.1007/978-3-031-93930-3_24,candidate_review,application/system,Borderline,application/system paper — likely EC4 unless it defines a reusable benchmark
Springer,Design and Evaluation of an Agentic AI Framework for Personalized Umrah Trip Planning,10.1007/s13369-025-11021-z,candidate_agentic,application/system,Borderline,application/system paper — likely EC4 unless it defines a reusable benchmark
Springer,"Development and evaluation of a colorimetric LAMP-based biosensor for rapid detection of a nosocomial infection agent, <i>Citrobacter freundii</i>",10.1038/s41598-023-49329-1,candidate_review,unclear,Borderline,no clear signal from title — needs abstract
Springer,Embedding ethical governance in personal AI systems: design and evaluation of a user-centred oversight agent,10.1007/s43681-026-01193-1,candidate_agentic,application/system,Borderline,application/system paper — likely EC4 unless it defines a reusable benchmark
Springer,Evaluation of&#xa0;a&#xa0;Customer Development Simulator Using Large Language Model-Based Multi-agent System and&#xa0;Synthetic Respondents,10.1007/978-981-96-6938-7_22,candidate_agentic,application/system,Borderline,application/system paper — likely EC4 unless it defines a reusable benchmark
Springer,"LLM-Based Multi-agent Systems: Frameworks, Evaluation, Open Challenges, and Research Frontiers",10.1007/978-3-032-15632-7_9,candidate_agentic,survey,Borderline,survey/review/workshop (IC3? — check)
Springer,MAP: evaluation and multi-agent enhancement of large language models for inpatient pathways,10.1038/s44401-026-00085-0,candidate_agentic,application/system,Borderline,application/system paper — likely EC4 unless it defines a reusable benchmark
Springer,MATEval: A Multi-agent Discussion Framework for&#xa0;Advancing Open-Ended Text Evaluation,10.1007/978-981-97-5575-2_31,candidate_review,unclear,Borderline,no clear signal from title — needs abstract
Springer,"Molecular characterization and evaluation of novel management options for <i>Burkholderia glumae</i> BG1, the causative agent of panicle blight of rice (<i>Oryza sativa</i> L.)",10.1007/s11033-024-09498-2,candidate_review,unclear,Borderline,no clear signal from title — needs abstract
Springer,Multi-agent System for Intelligent Heating Control: Implementation and Evaluation Using Home Assistant and Neural Networks,10.1007/978-3-032-20746-3_10,candidate_agentic,application/system,Borderline,application/system paper — likely EC4 unless it defines a reusable benchmark
Springer,Multi-agent System for Multi-modal Educational Content Generation and Evaluation: A Case Study,10.1007/978-981-95-7144-4_34,candidate_agentic,application/system,Borderline,application/system paper — likely EC4 unless it defines a reusable benchmark
Springer,Potential Play Evaluation with Learning-Based Agent Modeling,10.1007/978-981-96-1445-5_4,candidate_review,unclear,Borderline,no clear signal from title — needs abstract
Springer,Preparation and Evaluation of Hydrophobically Associating Polyacrylamide Liquid Suspension Agent for Oil Well Cement,10.1007/978-981-96-4922-8_68,candidate_review,unclear,Borderline,no clear signal from title — needs abstract
Springer,Quality Tuning and Evaluation with Agent Bricks,10.1007/979-8-8688-2524-8_7,candidate_review,unclear,Borderline,no clear signal from title — needs abstract
Springer,Safety rapid evaluation method and system of pump truck upper structure based on combination weighting and agent model,10.1186/s44147-025-00713-w,candidate_review,application/system,Borderline,application/system paper — likely EC4 unless it defines a reusable benchmark
Springer,T2F: a domain-agnostic multi-agent framework for unstructured text to factuality evaluation items generation,10.1007/s44163-025-00294-w,candidate_review,unclear,Borderline,no clear signal from title — needs abstract
Springer,Using Generated Rubrics to&#xa0;Provide a&#xa0;Window Into Item Evaluation with&#xa0;Multi-agent LLMs,10.1007/978-3-031-98420-4_15,candidate_agentic,unclear,Borderline,no clear signal from title — needs abstract
Springer,Value-based large language model agent simulation for mutual evaluation of trust and interpersonal closeness,10.1038/s41598-025-25531-1,candidate_agentic,unclear,Borderline,no clear signal from title — needs abstract
